{
  "id": "1b.3",
  "phase": "1",
  "plan_ref": "docs/plans/2026-10-12-phase1-structure-refactor.md",
  "feature_ids": [
    "F-1b-3"
  ],
  "context_digest": "62903fd3bd7a0735f133547f739bddf479f62fbbc1764296d98c9fe488f9577a",
  "allowed_paths": [
    "AGENTS.md",
    "CLAUDE.md",
    "README.md",
    "docs/**",
    "evidence/**",
    "harness/state/**",
    "docs/handoffs/**",
    "docs/plans/2026-10-12-phase1-structure-refactor.md"
  ],
  "acceptance": [
    "repo_move.py check reports 0 broken links",
    "uv run python scripts/check_agent_skills.py passes",
    "full gate passes"
  ],
  "gate_set": "full",
  "base_commit": "edc7f2d004d5d44a048ab658e7a787b668686329",
  "created_at": "2026-10-13T06:19:42+00:00"
}
