{
  "id": "1c.6",
  "phase": "1",
  "plan_ref": "docs/plans/2026-10-12-phase1-structure-refactor.md",
  "feature_ids": [
    "F-1c-6"
  ],
  "context_digest": "a2b4ec3a4bdb3b53466866f585df5180d73ca1bacddd809954b70f40284769a9",
  "allowed_paths": [
    "src/e_agent/kernel/**",
    "evidence/**",
    "harness/state/**",
    "docs/handoffs/**",
    "docs/plans/2026-10-12-phase1-structure-refactor.md"
  ],
  "acceptance": [
    "pytest -q tests/unit/kernel passes",
    "full gate passes"
  ],
  "gate_set": "full",
  "base_commit": "d34e5ac751252710c43afd0dfd08a8622fa1e184",
  "created_at": "2026-10-13T06:35:11+00:00"
}
