{
  "id": "1a.1",
  "phase": "1",
  "plan_ref": "docs/superpowers/plans/2026-10-12-phase1-structure-refactor.md",
  "feature_ids": [
    "F-1a-1"
  ],
  "context_digest": "ac1d74e9c352d0cec3abef9a18a5ac835ce7b0ccf9983af9f67be7356c992987",
  "allowed_paths": [
    "evidence/**",
    "docs/handoffs/**",
    "harness/state/**",
    "docs/handoffs/**",
    "docs/superpowers/plans/2026-10-12-phase1-structure-refactor.md"
  ],
  "acceptance": [
    "record the full gate counts",
    "record uv run python scripts/check_wheels.py output",
    "record scripts/plugin_inventory.py hashes for domain-erp and odoo19 built from fresh wheels",
    "list the files of all 10 built wheels with unzip -l as the must-be-identical reference"
  ],
  "gate_set": "full",
  "base_commit": "b4b80888e3564ebb998c18a1bf939b19d3ce5d71",
  "created_at": "2026-10-13T01:10:00+00:00"
}
