{
  "id": "1b.2",
  "phase": "1",
  "plan_ref": "docs/plans/2026-10-12-phase1-structure-refactor.md",
  "feature_ids": [
    "F-1b-2"
  ],
  "context_digest": "9eaaf9089f433ad155516a9f00473530baf8c6dd6e83d21800a02be2790b2575",
  "allowed_paths": [
    "docs/**",
    "AGENTS.md",
    "CLAUDE.md",
    "README.md",
    "harness/context.toml",
    "harness/samples/**",
    "scripts/check_agent_skills.py",
    ".agents/**",
    "tests/conformance/**",
    "evidence/**",
    "harness/state/**",
    "docs/handoffs/**",
    "docs/plans/2026-10-12-phase1-structure-refactor.md"
  ],
  "acceptance": [
    "active plans are in docs/plans/ and specs in docs/specs/",
    "docs/superpowers/ no longer exists",
    "the roadmap Rules plan-location sentence is updated",
    "repo_move.py check reports 0 broken links"
  ],
  "gate_set": "full",
  "base_commit": "32a72023d04adeb008f126edfada412266f15636",
  "created_at": "2026-10-13T06:18:08+00:00"
}
